{"$id":"sentinel://contracts/act/disposition.v0.1","$schema":"http://json-schema.org/draft-07/schema#","additionalProperties":false,"allOf":[{"if":{"properties":{"reason_code":{"const":"error"}}},"then":{"properties":{"reason_detail":{"additionalProperties":false,"properties":{"error_code":{"description":"Snake-cased exception class (gate.py _error_code: strips 'Jev' prefix, CamelCase→snake_case). Was f\"error:{code}\".","pattern":"^[a-z][a-z0-9_]*$","type":"string"}},"required":["error_code"],"type":"object"}}}},{"if":{"properties":{"reason_code":{"const":"freshness_veto"}}},"then":{"properties":{"reason_detail":{"additionalProperties":false,"properties":{"stale_legs":{"description":"Every stale leg named (ADR-014: no silent short-circuit). Was \"freshness:\" + \"|\".join(fresh_reasons).","items":{"type":"string"},"minItems":1,"type":"array"}},"required":["stale_legs"],"type":"object"}}}},{"if":{"properties":{"reason_code":{"const":"firewall_flagged"}}},"then":{"properties":{"reason_detail":{"additionalProperties":false,"properties":{"detectors":{"description":"Instruction-firewall detectors that fired. Was verdict.reason() = 'firewall_flagged:<detectors>'.","items":{"type":"string"},"minItems":1,"type":"array"},"evidence":{"description":"Optional inline evidence snippets; full evidence rides evidence_refs.","items":{"type":"string"},"type":"array"}},"required":["detectors"],"type":"object"}}}},{"if":{"properties":{"reason_code":{"const":"failopen"}}},"then":{"properties":{"reason_detail":{"additionalProperties":false,"properties":{"digest":{"description":"true when the step folded into the aggregate digest instead of paging (failopen_step2_digest/step3_digest).","type":"boolean"},"error_code":{"description":"Present when the step fired because of an error (failopen_stepN_error).","pattern":"^[a-z][a-z0-9_]*$","type":"string"},"step":{"description":"Which fail-open ladder step fired.","maximum":3,"minimum":1,"type":"integer"}},"required":["step","digest"],"type":"object"}}}},{"if":{"properties":{"reason_code":{"const":"policy_block"}}},"then":{"properties":{"reason_detail":{"additionalProperties":false,"properties":{"policy_reason":{"description":"Policy-layer reason code, e.g. 'policy_gate_not_configured' (policy_lifecycle.py:535). Open vocabulary pending Q3 (canonical PolicyVersion.content) — Type-1, Aditya's item.","type":"string"}},"required":["policy_reason"],"type":"object"}}}},{"if":{"properties":{"reason_code":{"enum":["threshold","allowlist","uncertain","shadow","dedup","change_window","storm","storm_digest","model_drift","verified_resolve","operator_resolve","label_pipeline_stale","commit_watchdog_trip"]}}},"then":{"properties":{"reason_detail":{"description":"Simple reasons carry no structured fields. If data is needed, the reason belongs in the structured set — propose an amendment, don't stuff reason_detail.","maxProperties":0}}}}],"description":"The command L4 hands L5: what to DO about an alert, why (machine-checkable), and where the proof lives. Vocabulary pinned pending-R9-ratification (see README §1). Wire serialization is explicit and versioned: every instance carries contract + contract_version; history is never rewritten (event log is the audit trail).","properties":{"action":{"description":"Closed action vocabulary (models.py:29). 'folded' (D3): storm-continuation absorbed into the aggregate page — intentionally not forwarded, NOT suppression.","enum":["page_now","page_business_hours","suppress","passthrough","folded"],"type":"string"},"contract":{"const":"disposition","description":"Self-identifying contract name on the wire."},"contract_version":{"const":"v0.1","description":"Additive-only changes inside a version; a true break takes a new version (C7 compat rule, OPERATING-RULES §1.1). Vocabulary values themselves are pinned pending-R9-ratification — see README §1."},"detail":{"description":"Human-readable occurrence text (RFC 9457 'detail': specific to this occurrence, never the same text twice). Consumers MUST NOT parse this for logic — machine logic reads reason_code + reason_detail only. See README 'never-crosses'.","maxLength":2000,"type":"string"},"evidence_refs":{"description":"References (content hashes, URIs) to the evidence behind the decision: Jev answers, firewall evidence tuples, freshness reports, policy attestation refs. The disposition carries pointers, never raw vendor payloads.","items":{"type":"string"},"type":"array"},"reason_code":{"description":"Closed reason vocabulary (P2/R-9 target). reason_code NEVER carries interpolated data — no 'error:TimeoutError', no 'freshness:leg1|leg2'. Structured data lives in reason_detail as FIELDS. pattern + enum together reject the old stringly-typed shapes.","enum":["threshold","allowlist","uncertain","shadow","dedup","change_window","storm","storm_digest","model_drift","verified_resolve","operator_resolve","label_pipeline_stale","commit_watchdog_trip","error","freshness_veto","firewall_flagged","failopen","policy_block"],"pattern":"^[a-z][a-z0-9_]*$","type":"string"},"reason_detail":{"description":"Structured variant payload for reason_code values that carry data. Selected by reason_code (see allOf). Simple reasons carry NO fields here — maxProperties 0.","type":"object"}},"required":["contract","contract_version","action","reason_code","evidence_refs"],"title":"Disposition — C4 (L4 DECIDE-2 → L5 ACT), v0.1","type":"object"}