{"action":"page_now","contract":"disposition","contract_version":"v0.1","detail":"suppress conjunction satisfied on values but 2 of 3 freshness legs stale — stale proof vetoes suppression, paging instead","evidence_refs":["freshness:report#2026-10-05T14:33Z","sha256:be70…dd02"],"reason_code":"freshness_veto","reason_detail":{"stale_legs":["lock1_calibration: 26h old (ttl 24h)","lock3_anchor: checkpoint missing since 2026-10-04T22:10Z"]}}